{
  "proposal_id": "019d7b92-1aa0-7a7f-b61c-962c0f4bfda0",
  "proposal_contract_version": 1,
  "idempotency_key": "urn:cwl:tenant_001:issued_invoice_void:019d7b92-1aa0-7a7f-b61c-962c0f4bfd90:sha256:eeeeeeeeeeeeeeeeeeeeeeeeeeeeeeeeeeeeeeeeeeeeeeeeeeeeeeeeeeeeeeee:v1",
  "tenant_reference": "urn:cwl:tenant_001",
  "legal_entity_reference": "urn:cwl:tenant_001:legal_entity:commercial",
  "intended_book_role_code": "primary_statutory",
  "transaction_currency": "USD",
  "transaction_date": "2026-08-18",
  "accounting_date": "2026-08-18",
  "source_payload_hash": "sha256:1818181818181818181818181818181818181818181818181818181818181818",
  "proposed_at": "2026-08-18T19:00:00Z",
  "proposal_status": "validated",
  "source_event_references": [
    "urn:cwl:tenant_001:issued_invoice_void:019d7b92-1aa0-7a7f-b61c-962c0f4bfd90"
  ],
  "lines": [
    {
      "line_number": 1,
      "account_role_code": "usage_revenue",
      "debit_amount": "100.00",
      "credit_amount": "0"
    },
    {
      "line_number": 2,
      "account_role_code": "tax_payable",
      "debit_amount": "10.00",
      "credit_amount": "0"
    },
    {
      "line_number": 3,
      "account_role_code": "accounts_receivable",
      "debit_amount": "0",
      "credit_amount": "110.00"
    }
  ]
}
