{
  "proposal_id": "019d7b92-1aa0-7a7f-b61c-962c0f4bfcb0",
  "proposal_contract_version": 1,
  "idempotency_key": "urn:cwl:tenant_001:cash_receipt:019d7b92-1aa0-7a7f-b61c-962c0f4bf650:sha256:bbbbbbbbbbbbbbbbbbbbbbbbbbbbbbbbbbbbbbbbbbbbbbbbbbbbbbbbbbbbbbbb:v1",
  "tenant_reference": "urn:cwl:tenant_001",
  "legal_entity_reference": "urn:cwl:tenant_001:legal_entity:commercial",
  "intended_book_role_code": "primary_statutory",
  "transaction_currency": "USD",
  "transaction_date": "2026-08-17",
  "accounting_date": "2026-08-17",
  "source_payload_hash": "sha256:bbbbbbbbbbbbbbbbbbbbbbbbbbbbbbbbbbbbbbbbbbbbbbbbbbbbbbbbbbbbbbbb",
  "proposed_at": "2026-08-17T21:00:00Z",
  "proposal_status": "validated",
  "source_event_references": [
    "urn:cwl:tenant_001:cash_receipt:019d7b92-1aa0-7a7f-b61c-962c0f4bf650"
  ],
  "lines": [
    {
      "line_number": 1,
      "account_role_code": "cash_receipt",
      "debit_amount": "0.003705",
      "credit_amount": "0"
    },
    {
      "line_number": 2,
      "account_role_code": "accounts_receivable",
      "debit_amount": "0",
      "credit_amount": "0.003705"
    }
  ]
}
